"LocationName","Address","City","State","Zip","Description","Website","Phone","lat","lng"
"South Boston Community Market 22","441 Boylston St.","SOUTH BOSTON","MA","02127","Tuesday, 12:00 pm - 6:00 pm, June to November; WIC, HIP & SNAP-EBT Accepted.","","","42.337175","-71.045873"
"East Boston Fresh Market 23","817 Cummins Hwy.","EAST BOSTON","MA","02128","Wednesday, 10:00 am - 2:00 pm, Year-Round; SNAP-EBT Accepted with select vendors.","","","42.372357","-71.042664"
"Charlestown Farm Stand 24","856 Hyde Park Ave.","CHARLESTOWN","MA","02129","Saturday, 9:00 am - 1:00 pm, May to October; Cash only.","","","42.381408","-71.058323"
"Fenway Mobile Market 25","692 Morton St.","FENWAY","MA","02115","Wednesday, 10:00 am - 2:00 pm, Year-Round; Cash only.","","","42.343763","-71.102642"
"Jamaica Plain Growers Market 26","693 Harvard St.","JAMAICA PLAIN","MA","02130","Saturday, 9:00 am - 1:00 pm, May to October; WIC & Senior Coupons Accepted; SNAP-EBT Accepted.","","","42.325844","-71.081579"
"Roslindale Growers Market 27","665 Columbus Ave.","ROSLINDALE","MA","02131","Thursday, 3:00 pm - 7:00 pm, June to October; WIC & Senior Coupons Accepted; SNAP-EBT Accepted.","","","42.282348","-71.120488"
"Charlestown Farmers Market 28","419 Washington St.","CHARLESTOWN","MA","02129","Sunday, 11:00 am - 3:00 pm, Year-Round; WIC, HIP & SNAP-EBT Accepted.","","","42.372845","-71.059802"
"Charlestown Fresh Market 29","775 Centre St.","CHARLESTOWN","MA","02129","Saturday & Sunday, 10:00 am - 2:00 pm, June to November; Cash only.","","","42.385996","-71.06445"
"West Roxbury Mobile Market 30","766 American Legion Hwy.","WEST ROXBURY","MA","02132","Sunday, 11:00 am - 3:00 pm, Year-Round; WIC, HIP & SNAP-EBT Accepted.","","","42.282068","-71.153978"
"West Roxbury Community Market 31","793 Hyde Park Ave.","WEST ROXBURY","MA","02132","Wednesday, 10:00 am - 2:00 pm, Year-Round; SNAP-EBT Accepted.","","","42.288792","-71.153285"
"Dorchester Farmers Market 32","604 Washington St.","DORCHESTER","MA","02121","Thursday, 3:00 pm - 7:00 pm, June to October; SNAP-EBT Accepted with select vendors.","","","42.299146","-71.06717"
"Hyde Park Community Market 33","612 Hyde Park Ave.","HYDE PARK","MA","02136","Wednesday, 10:00 am - 2:00 pm, Year-Round; SNAP-EBT Accepted.","","","42.264153","-71.119215"
"Allston Community Market 34","818 Centre St.","ALLSTON","MA","02134","Thursday, 3:00 pm - 7:00 pm, June to October; SNAP-EBT Accepted with select vendors.","","","42.354712","-71.129548"
"South Boston Growers Market 35","898 Dudley St.","SOUTH BOSTON","MA","02127","Friday, 2:00 pm - 6:00 pm, July to October; Cash only.","","","42.339427","-71.041022"
"Roxbury Farm Stand 36","378 Columbus Ave.","ROXBURY","MA","02119","Saturday, 9:00 am - 1:00 pm, May to October; Cash only.","","","42.333308","-71.076984"
"Allston Mobile Market 37","198 Dudley St.","ALLSTON","MA","02134","Sunday, 11:00 am - 3:00 pm, Year-Round; Cash only.","","","42.36437","-71.114252"
"South End Fresh Market 38","255 Cummins Hwy.","SOUTH END","MA","02118","Tuesday, 12:00 pm - 6:00 pm, June to November; SNAP-EBT Accepted.","","","42.348735","-71.063706"
"East Boston Farmers Market 39","680 Morton St.","EAST BOSTON","MA","02128","Sunday, 11:00 am - 3:00 pm, Year-Round; WIC, HIP & SNAP-EBT Accepted.","","","42.369556","-71.047684"
"East Boston Farm Stand 40","433 Columbus Ave.","EAST BOSTON","MA","02128","Wednesday, 10:00 am - 2:00 pm, Year-Round; WIC, HIP & SNAP-EBT Accepted.","","","42.38116","-71.040749"
"Jamaica Plain Farm Stand 41","360 VFW Pkwy.","JAMAICA PLAIN","MA","02130","Sunday, 11:00 am - 3:00 pm, Year-Round; SNAP-EBT Accepted with select vendors.","","","42.312653","-71.085697"
"Hyde Park Farm Stand 42","803 American Legion Hwy.","HYDE PARK","MA","02136","Saturday & Sunday, 10:00 am - 2:00 pm, June to November; WIC & Senior Coupons Accepted; SNAP-EBT Accepted.","","","42.248409","-71.130407"
"Brighton Farmers Market 43","682 Harvard St.","BRIGHTON","MA","02135","Sunday, 11:00 am - 3:00 pm, Year-Round; WIC & Senior Coupons Accepted; SNAP-EBT Accepted.","","","42.355361","-71.147074"
"East Boston Fresh Market 44","678 Dudley St.","EAST BOSTON","MA","02128","Tuesday, 12:00 pm - 6:00 pm, June to November; SNAP-EBT Accepted.","","","42.377645","-71.033049"
"Roxbury Farmers Market 45","568 Blue Hill Ave.","ROXBURY","MA","02119","Saturday & Sunday, 10:00 am - 2:00 pm, June to November; WIC, HIP & SNAP-EBT Accepted.","","","42.334639","-71.090002"
"West Roxbury Farm Stand 46","811 Morton St.","WEST ROXBURY","MA","02132","Sunday, 11:00 am - 3:00 pm, Year-Round; WIC, HIP & SNAP-EBT Accepted.","","","42.28449","-71.1568"
"East Boston Community Market 47","801 Washington St.","EAST BOSTON","MA","02128","Saturday & Sunday, 10:00 am - 2:00 pm, June to November; Cash only.","","","42.367984","-71.044668"
"Dorchester Growers Market 48","160 Cummins Hwy.","DORCHESTER","MA","02121","Sunday, 11:00 am - 3:00 pm, Year-Round; SNAP-EBT Accepted.","","","42.29666","-71.060697"
"Roslindale Farm Stand 49","109 Warren St.","ROSLINDALE","MA","02131","Sunday, 11:00 am - 3:00 pm, Year-Round; Cash only.","","","42.288194","-71.125156"
"Mission Hill Farm Stand 50","92 Boylston St.","MISSION HILL","MA","02120","Saturday & Sunday, 10:00 am - 2:00 pm, June to November; WIC & Senior Coupons Accepted; SNAP-EBT Accepted.","","","42.336133","-71.102484"
"East Boston Fresh Market 51","613 Washington St.","EAST BOSTON","MA","02128","Thursday, 3:00 pm - 7:00 pm, June to October; SNAP-EBT Accepted.","","","42.370011","-71.045041"
"Jamaica Plain Fresh Market 52","912 Columbus Ave.","JAMAICA PLAIN","MA","02130","Saturday, 9:00 am - 1:00 pm, May to October; SNAP-EBT Accepted with select vendors.","","","42.312025","-71.085905"
"Dorchester Farm Stand 53","51 Harvard St.","DORCHESTER","MA","02121","Sunday, 11:00 am - 3:00 pm, Year-Round; SNAP-EBT Accepted with select vendors.","","","42.307738","-71.065248"
"Roslindale Mobile Market 54","858 Washington St.","ROSLINDALE","MA","02131","Saturday & Sunday, 10:00 am - 2:00 pm, June to November; SNAP-EBT Accepted with select vendors.","","","42.285985","-71.126136"
"Hyde Park Community Market 55","700 Washington St.","HYDE PARK","MA","02136","Friday, 2:00 pm - 6:00 pm, July to October; Cash only.","","","42.253844","-71.120619"
"Roslindale Fresh Market 56","243 Centre St.","ROSLINDALE","MA","02131","Thursday, 3:00 pm - 7:00 pm, June to October; SNAP-EBT Accepted.","","","42.278819","-71.124339"
"Roxbury Farmers Market 57","873 Hyde Park Ave.","ROXBURY","MA","02119","Thursday, 3:00 pm - 7:00 pm, June to October; SNAP-EBT Accepted.","","","42.33318","-71.092483"
"Mattapan Farm Stand 58","144 Boylston St.","MATTAPAN","MA","02126","Friday, 2:00 pm - 6:00 pm, July to October; SNAP-EBT Accepted with select vendors.","","","42.275603","-71.087157"
"Roxbury Mobile Market 59","603 Warren St.","ROXBURY","MA","02119","Wednesday, 10:00 am - 2:00 pm, Year-Round; SNAP-EBT Accepted.","","","42.339788","-71.092359"
"Allston Farmers Market 60","969 Cummins Hwy.","ALLSTON","MA","02134","Wednesday, 10:00 am - 2:00 pm, Year-Round; WIC, HIP & SNAP-EBT Accepted.","","","42.3566","-71.124076"
"South Boston Farmers Market 61","948 Hyde Park Ave.","SOUTH BOSTON","MA","02127","Saturday, 9:00 am - 1:00 pm, May to October; WIC, HIP & SNAP-EBT Accepted.","","","42.334778","-71.044995"
"South Boston Farmers Market 62","223 Morton St.","SOUTH BOSTON","MA","02127","Thursday, 3:00 pm - 7:00 pm, June to October; WIC, HIP & SNAP-EBT Accepted.","","","42.33553","-71.043788"
"Roxbury Farm Stand 63","496 Morton St.","ROXBURY","MA","02119","Wednesday, 10:00 am - 2:00 pm, Year-Round; SNAP-EBT Accepted with select vendors.","","","42.326021","-71.083715"
"Roslindale Fresh Market 64","526 Boylston St.","ROSLINDALE","MA","02131","Tuesday, 12:00 pm - 6:00 pm, June to November; WIC & Senior Coupons Accepted; SNAP-EBT Accepted.","","","42.279329","-71.131918"
"Hyde Park Fresh Market 65","441 American Legion Hwy.","HYDE PARK","MA","02136","Sunday, 11:00 am - 3:00 pm, Year-Round; SNAP-EBT Accepted.","","","42.250649","-71.127667"
"Fenway Farm Stand 66","352 Cummins Hwy.","FENWAY","MA","02115","Tuesday, 12:00 pm - 6:00 pm, June to November; SNAP-EBT Accepted.","","","42.354679","-71.098338"
"East Boston Farmers Market 67","204 Boylston St.","EAST BOSTON","MA","02128","Friday, 2:00 pm - 6:00 pm, July to October; SNAP-EBT Accepted with select vendors.","","","42.367932","-71.031696"
"Charlestown Fresh Market 68","271 Washington St.","CHARLESTOWN","MA","02129","Sunday, 11:00 am - 3:00 pm, Year-Round; SNAP-EBT Accepted with select vendors.","","","42.372732","-71.062638"
"Roxbury Farm Stand 69","362 American Legion Hwy.","ROXBURY","MA","02119","Friday, 2:00 pm - 6:00 pm, July to October; SNAP-EBT Accepted with select vendors.","","","42.332555","-71.089434"
"Jamaica Plain Community Market 70","976 Washington St.","JAMAICA PLAIN","MA","02130","Wednesday, 10:00 am - 2:00 pm, Year-Round; WIC & Senior Coupons Accepted; SNAP-EBT Accepted.","","","42.320749","-71.078573"
"Allston Community Market 71","28 Harvard St.","ALLSTON","MA","02134","Thursday, 3:00 pm - 7:00 pm, June to October; WIC & Senior Coupons Accepted; SNAP-EBT Accepted.","","","42.36209","-71.117864"
"Jamaica Plain Farm Stand 72","39 Centre St.","JAMAICA PLAIN","MA","02130","Wednesday, 10:00 am - 2:00 pm, Year-Round; SNAP-EBT Accepted with select vendors.","","","42.320973","-71.07991"
"Dorchester Mobile Market 73","670 Washington St.","DORCHESTER","MA","02121","Tuesday, 12:00 pm - 6:00 pm, June to November; Cash only.","","","42.293957","-71.062008"
"Hyde Park Mobile Market 74","388 Cummins Hwy.","HYDE PARK","MA","02136","Sunday, 11:00 am - 3:00 pm, Year-Round; Cash only.","","","42.260118","-71.117222"
"Brighton Community Market 75","344 Morton St.","BRIGHTON","MA","02135","Saturday & Sunday, 10:00 am - 2:00 pm, June to November; SNAP-EBT Accepted.","","","42.346319","-71.145817"
"Mission Hill Community Market 76","44 Tremont St.","MISSION HILL","MA","02120","Saturday, 9:00 am - 1:00 pm, May to October; WIC, HIP & SNAP-EBT Accepted.","","","42.324044","-71.093427"
"Fenway Farm Stand 77","649 Tremont St.","FENWAY","MA","02115","Thursday, 3:00 pm - 7:00 pm, June to October; Cash only.","","","42.347096","-71.095365"
"Brighton Mobile Market 78","89 Warren St.","BRIGHTON","MA","02135","Tuesday, 12:00 pm - 6:00 pm, June to November; SNAP-EBT Accepted.","","","42.346481","-71.136438"
"Mission Hill Mobile Market 79","836 Morton St.","MISSION HILL","MA","02120","Thursday, 3:00 pm - 7:00 pm, June to October; SNAP-EBT Accepted with select vendors.","","","42.331374","-71.104967"
"Hyde Park Farmers Market 80","557 Boylston St.","HYDE PARK","MA","02136","Saturday, 9:00 am - 1:00 pm, May to October; Cash only.","","","42.260253","-71.132274"
